<!--
    PUBLIC ID: -//coreplus//vocabulary//EN
    SYSTEM ID: http://corepl.us/api/2_4/component.dtd

	Last revision date: 2013.12.03
-->

<!--
	An example how to use this DTD from your XML document:

	<?xml version="1.0"?>
	<!DOCTYPE component SYSTEM "http://corepl.us/api/2_4/component.dtd">

	<component>
	...
	</component>
-->

<!--
	Component is the main container for everything for a given... well, component.
	It's the root node, and each component can only contain one component.xml, which contains only one component directive.

	The component directive MUST have a name and version attribute.
	The name MUST match the component's directory, (capitalization is optional).
	The version SHOULD start with a number, and ideally have minor and point revisions, optionally with a third party flag at the end.
-->
<!ELEMENT component (licenses|authors|files|install|(otherfiles|requires|provides|hooks|smartyplugins|includes|pages|view|description|configs|users|userconfigs|assets|upgrades|forms|widgets|permissions)?)>
<!ATTLIST component
	execmode (web|cli|both) "web"
	name CDATA #REQUIRED
	version CDATA #REQUIRED
	xmlns:xsi CDATA #FIXED "http://www.w3.org/2001/XMLSchema-instance"
>

<!--
	Provides element is a list of provide statements indicating what this component has.
	A <provides> block MUST have one or more <provide> statement within.
-->
<!ELEMENT provides (provide|scriptlibrary)+>

<!ELEMENT provide EMPTY>
<!ATTLIST provide
version CDATA #REQUIRED
name CDATA #REQUIRED
type CDATA #IMPLIED
>
<!ELEMENT scriptlibrary EMPTY>
<!ATTLIST scriptlibrary
	name CDATA #REQUIRED
	call CDATA #IMPLIED
	>

<!ELEMENT forms (formelement)>
<!ELEMENT formelement EMPTY>
<!ATTLIST formelement name CDATA #REQUIRED class CDATA #REQUIRED>

<!ELEMENT requires (require)+>

<!ELEMENT require EMPTY>
<!ATTLIST require
	name CDATA #REQUIRED
	type CDATA #REQUIRED
	version CDATA #IMPLIED
	operation (lt|le|eq|ge|gt) "ge"
	>

<!--- Put your DTDDoc comment here. -->
<!ELEMENT hooks (hookregister|hook)*>

<!ELEMENT hookregister EMPTY>
<!ATTLIST hookregister
	name CDATA #REQUIRED
	description CDATA #IMPLIED
	return (array|bool|string|void) "bool"
	>

<!--- Put your DTDDoc comment here. -->
<!ELEMENT hook EMPTY>
<!ATTLIST hook
	name CDATA #REQUIRED
	call CDATA #REQUIRED
	>

<!--
	Smarty plugins root directive.
	Contains the directory functional plugins are located in and its children can be the individual calls.
-->
<!ELEMENT smartyplugins (smartyplugin)*>
<!ATTLIST smartyplugins
	directory CDATA #REQUIRED
	>

<!-- An individual smarty plugin registration.  Useful if you want to namespace your classes or organize them differently. -->
<!ELEMENT smartyplugin EMPTY>
<!ATTLIST
	name CDATA #REQUIRED
	call CDATA #REQUIRED
	>

<!--- Put your DTDDoc comment here. -->
<!ELEMENT includes (include)*>

<!--- Put your DTDDoc comment here. -->
<!ELEMENT include EMPTY>
<!ATTLIST include
	filename CDATA #REQUIRED
	>

<!--- Put your DTDDoc comment here. -->
<!ELEMENT files (file)*>

<!--- Put your DTDDoc comment here. -->
<!ELEMENT file (class|interface|widget|controller)*>
<!ATTLIST file
	md5 CDATA #IMPLIED
	filename CDATA #REQUIRED
	>

<!ELEMENT class EMPTY>
<!ATTLIST class
	name CDATA #REQUIRED
>

<!ELEMENT interface EMPTY>
<!ATTLIST interface
	name CDATA #REQUIRED
>

<!ELEMENT controller EMPTY>
<!ATTLIST controller
	name CDATA #REQUIRED
>

<!--- Put your DTDDoc comment here. -->
<!ELEMENT pages (page)*>

<!--- Put your DTDDoc comment here. -->
<!ELEMENT page EMPTY>
<!ATTLIST page
	baseurl CDATA #REQUIRED
	rewriteurl CDATA #IMPLIED
	title CDATA #REQUIRED
	access CDATA #IMPLIED
	admin (0|1) "0"
	group CDATA #IMPLIED
	selectable (0|1) "1"
>

<!--- Put your DTDDoc comment here. -->
<!ELEMENT widgets (widget)*>

<!--- Put your DTDDoc comment here. -->
<!ELEMENT widget EMPTY>
<!ATTLIST widget
	baseurl CDATA #REQUIRED
	title CDATA #IMPLIED
	installable CDATA #IMPLIED
>

<!--- Put your DTDDoc comment here. -->
<!ELEMENT view (file)*>
<!ATTLIST view
	searchdir CDATA #IMPLIED
>

<!--- Put your DTDDoc comment here. -->
<!ELEMENT install (dataset|phpfileinclude|php|sql)*>

<!--- Put your DTDDoc comment here. -->
<!ELEMENT description (#PCDATA)>

<!--- Set of site configuration options -->
<!ELEMENT configs (config)*>

<!--- Each configuration option, editable from within system configuration -->
<!ELEMENT config EMPTY>
<!ATTLIST config
	key CDATA #REQUIRED
	type (string|int|boolean|enum|set) 'string'
	options CDATA #IMPLIED
	description CDATA #IMPLIED
	default CDATA #IMPLIED
	mapto CDATA #IMPLIED
>

<!-- 2.8.x User options, all contained within the <user/> key -->
<!ELEMENT users (userconfig|userauth)*>

<!--- pre-2.8.x User config options, since they're usually defined by the components. -->
<!ELEMENT userconfigs (userconfig)*>

<!--- The actual user configuration option, contained within uesrconfigs -->
<!ELEMENT userconfig EMPTY>
<!ATTLIST userconfig
	key CDATA #REQUIRED
	name CDATA #REQUIRED
	formtype CDATA #IMPLIED
	default CDATA #IMPLIED
	options CDATA #IMPLIED
	weight CDATA #IMPLIED
	onregistration (0|1) "1"
	onedit (0|1) "1"
	hidden (0|1) "0"
	searchable (0|1) "0"
	required (0|1) "0"
	validation CDATA #IMPLIED
>

<!ELEMENT userauth EMPTY>
<!ATTLIST userauth
	name CDATA #REQUIRED
	class CDATA #REQUIRED
>

<!--- Permissions contain all permissions used in this component -->
<!ELEMENT permissions (permission)*>

<!--
  - Each permission that is used throughout the component, useful for displaying the names in the group admin
  - Must have a "key" attribute that will be used to check for that permission throughout the site.
  - Should have a "description" attribute that will describe to the system admin what this permission does.
  - May have a "context" attribute that indicates to the system that it must be bound to a Model with the given basename.
  -->
<!ELEMENT permission EMPTY>
<!ATTLIST permission
	key CDATA #REQUIRED
	description CDATA #IMPLIED
	context CDATA #IMPLIED
>

<!--- Put your DTDDoc comment here. -->
<!ELEMENT assets (file)*>

<!--- Put your DTDDoc comment here. -->
<!ELEMENT upgrades (upgrade)*>

<!--- Put your DTDDoc comment here. -->
<!ELEMENT upgrade (dataset|phpfileinclude|php|sql)*>
<!ATTLIST upgrade
	to CDATA #IMPLIED
	from CDATA #IMPLIED
>

<!-- Execute a SQL file, (after transposed through the dataset abstraction system) -->
<!ELEMENT sql EMPTY>
<!ATTLIST sql
	file CDATA #REQUIRED "The sql file to execute, relative to the component directory"
>

<!--
Execute a low-level dataset operation on the installation or upgrade.
-->
<!ELEMENT dataset (datasetset|datasetwhere|datasetrenamecolumn)*>
<!ATTLIST dataset
	action (update|insert|delete|alter) #REQUIRED
	table CDATA #REQUIRED
>

<!--
	The "SET" clause for datasets.  Useful for UPDATE and INSERT statements.
	The only attribute (which is required), is "key" and the nodeValue is the value that is set for that key.
-->
<!ELEMENT datasetset (#PCDATA)>
<!ATTLIST datasetset
	key CDATA #REQUIRED
>

<!--
	The "WHERE" clause for datasets.  Useful for all types of statements.
	The nodeValue here is the where statement, which is parsed via the dataset system.
-->
<!ELEMENT datasetwhere (#PCDATA)>

<!--
	The system cannot handle renames natively, as a renamed column in the schema is seen as a new column.
	This will allow you to rename a column in the schema during an upgrade.

	Please note, this is ONLY applicable with the "alter" action in the dataset.
-->
<!ELEMENT datasetrenamecolumn EMPTY>
<!ATTLIST datasetrenamecolumn
	oldname CDATA #REQUIRED
	newname CDATA #REQUIRED
>

<!-- The phpfileinclude allows upgrades and installs to call a custom php file to be executed automatically. -->
<!ELEMENT phpfileinclude (#PCDATA)>

<!-- The PHP element is a more short-hand version of phpfileinclude. -->
<!ELEMENT php EMPTY>
<!ATTLIST php
	file CDATA #REQUIRED "The filename, relative to the component directory"
>

<!--- Put your DTDDoc comment here. -->
<!ELEMENT authors (author)*>

<!--- Put your DTDDoc comment here. -->
<!ELEMENT author EMPTY>
<!ATTLIST author
	email CDATA #IMPLIED
	name CDATA #IMPLIED
>

<!--- Put your DTDDoc comment here. -->
<!ELEMENT licenses (license)*>

<!--- Put your DTDDoc comment here. -->
<!ELEMENT license (#PCDATA)>
<!ATTLIST license
	url CDATA #IMPLIED
>

<!--- Put your DTDDoc comment here. -->
<!ELEMENT otherfiles (file)*>
