<?xml version="1.0" encoding="UTF-8"?>
<!DOCTYPE component SYSTEM "http://corepl.us/api/2_1/component.dtd">
<component xmlns:xsi="http://www.w3.org/2001/XMLSchema-instance" version="1.1.0" name="Blog" execmode="web">
	<requires>
		<require name="core" type="component" version="2.1.2" operation="ge"/>
	</requires>
	<permissions>
		<permission key="blog_manage" description="Manage Blogs"/>
	</permissions>
	<files>
		<file filename="CHANGELOG" md5="2b3c0bd0a6cab2108c1706372541c070"/>
		<file filename="controllers/BlogController.php" md5="cd5091afcdac35f31d1f4afbe22f527c">
			<controller name="BlogController"/>
		</file>
		<file filename="helpers/BlogHelper.php" md5="283487940f0c2b3aeb1bf590752e997c">
			<class name="BlogHelper"/>
		</file>
		<file filename="models/BlogArticleModel.php" md5="ed1cb08d304428994a06ebecfd6a27f4">
			<class name="BlogArticleModel"/>
		</file>
		<file filename="models/BlogArticleTagModel.php" md5="19113d6a799ff3b6012c99e22558720c">
			<class name="BlogArticleTagModel"/>
		</file>
		<file filename="models/BlogModel.php" md5="ea5583b821de87b3bc16443d3c14c7be">
			<class name="BlogModel"/>
		</file>
	</files>
	<pages>
		<page baseurl="/blog/admin" admin="1" widget="0" access="p:blog_manage" title="Blog Administration"/>
	</pages>
	<description>Blog system.</description>
	<view searchdir="templates">
		<file filename="templates/pages/blog/admin.tpl" md5="207445c551f7c2169d951b0a7b501e7c"/>
		<file filename="templates/pages/blog/article_create.tpl" md5="a6195cc78d3992aed8c907894ef8d9f2"/>
		<file filename="templates/pages/blog/article_update.tpl" md5="7188695d360bad19187f63c7da3fc2f8"/>
		<file filename="templates/pages/blog/create.tpl" md5="6795037bf2dc9bde8b4043b07839db46"/>
		<file filename="templates/pages/blog/update.tpl" md5="6795037bf2dc9bde8b4043b07839db46"/>
		<file filename="templates/pages/blog/view-blog-article.tpl" md5="1dcf8e2e960ec6c63ed9580a338c3e37"/>
		<file filename="templates/pages/blog/view-blog.tpl" md5="070dedce576bd0d23afec2f705a440ac"/>
	</view>
	<upgrades>
		<upgrade from="1.0.0" to="1.1.0"/>
	</upgrades>
	<authors>
		<author name="Charlie Powell" email="charlie@eval.bz"/>
	</authors>
	<licenses>
		<license url="http://www.gnu.org/licenses/agpl-3.0.txt">
			GNU Affero General Public License v3
		</license>
	</licenses>
</component>

