<?xml version="1.0" encoding="UTF-8"?>
<!DOCTYPE component SYSTEM "http://corepl.us/api/2_1/component.dtd">
<component xmlns:xsi="http://www.w3.org/2001/XMLSchema-instance" version="2.2.0~core1" name="jPlayer" execmode="web">
	<requires>
		<require name="core" type="component"/>
		<require name="JQuery" type="library" version="1.4" operation="ge"/>
	</requires>
	<provides>
		<scriptlibrary name="jplayer" call="jPlayer::IncludeJPlayer"/>
	</provides>
	<upgrades>
		<upgrade from="2.0.0" to="2.0.0~cae2"/>
		<upgrade from="2.0.0~cae2" to="2.0.0~cae3"/>
		<upgrade from="2.0.0~cae3" to="2.1.0~core1"/>
		<upgrade from="2.1.0~core1" to="2.2.0~core1"/>
	</upgrades>
	<files>
		<file filename="CHANGELOG" md5="4a80dadc8ec706b8544c2090f5625d83"/>
		<file filename="jPlayer.class.php" md5="69a6964e300f3f2ee1340a819d5bb725">
			<class name="jPlayer"/>
		</file>
		<file filename="source/Jplayer.as" md5="23d49380b77459bf3ac71dcb08c6bc68"/>
		<file filename="source/Jplayer.fla" md5="c6c6cda92c97d94640b62b75b5de3044"/>
		<file filename="source/add-on/jplayer.playlist.js" md5="db507525d94792ed399ce529b11f7475"/>
		<file filename="source/add-on/jquery.jplayer.inspector.js" md5="c009339d6136287c282eca94144f12c7"/>
		<file filename="source/happyworm/jPlayer/JplayerEvent.as" md5="469d26829c45403ac7317f3a9425b305"/>
		<file filename="source/happyworm/jPlayer/JplayerMp3.as" md5="c2f436e4a9ffde1f40022c3c1b49c36c"/>
		<file filename="source/happyworm/jPlayer/JplayerMp4.as" md5="870b1a69bee5fbca99e204d1c506df26"/>
		<file filename="source/happyworm/jPlayer/JplayerStatus.as" md5="9864cf02a6d737ce2e4bfdb3271f2309"/>
		<file filename="source/jquery.jplayer.js" md5="48350ca54c1c6dc29c1fc531826fab0b"/>
	</files>
	<assets>
		<file filename="assets/css/skin/jPlayer_blue.monday_extd.psd" md5="dfdf38678f1037f9dfee8539eda4bb4a"/>
		<file filename="assets/css/skin/jplayer.blue.monday.css" md5="f485a8bb1459850bbaf670b3bb39c0e3"/>
		<file filename="assets/css/skin/jplayer.blue.monday.jpg" md5="0e0fdecc749a3e48cba25ae991154029"/>
		<file filename="assets/css/skin/jplayer.blue.monday.seeking.gif" md5="6459e146ed61caa28e8ede05beb520b8"/>
		<file filename="assets/css/skin/jplayer.blue.monday.video.play.png" md5="d736613748cb6f59e1ce86db5e58bee0"/>
		<file filename="assets/css/skin/spirites_blue.monday_2011.psd" md5="0afab271084584b60d4f642bd9d60d4f"/>
		<file filename="assets/js/jplayer.playlist.min.js" md5="58f29924f2e0951ab6cbeb7e502d350e"/>
		<file filename="assets/js/jquery.jplayer.inspector.js" md5="efdcfd5a92b8aa45743788331113d7eb"/>
		<file filename="assets/js/jquery.jplayer.min.js" md5="0ab0a4d5b0b17a5697f08c78f7750f65"/>
		<file filename="assets/js/popcorn.jplayer.js" md5="af75a155444d1fe964eef1be9ba245e2"/>
		<file filename="assets/swf/Jplayer.swf" md5="f85e71a50abbaf2a1866ef16d392a420"/>
	</assets>
	<authors>
		<author name="Mark J Panaghiston"/>
	</authors>
</component>

