<?xml version="1.0" encoding="UTF-8"?>
<!DOCTYPE component SYSTEM "http://corepl.us/api/2_4/component.dtd">
<component xmlns:xsi="http://www.w3.org/2001/XMLSchema-instance" version="3.2.3-7" name="Facebook" execmode="web">
	<hooks>
		<hook name="/core/page/rendering" call="FacebookHelper::HookRenderPage"/>
		<hook name="/core/controllinks/usermodel" call="FacebookController::GetUserControlLinks"/>
	</hooks>
	<provides>
		<provide type="library" name="facebook-sdk" version="3.2.0"/>
		<scriptlibrary name="facebook" call="FacebookHelper::Includejs"/>
	</provides>
	<requires>
		<require name="user" type="library" version="2.8.0"/>
		<require name="core" type="component" version="3.5.0" operation="ge"/>
	</requires>
	<configs>
		<config key="/facebook/appid" mapto="FACEBOOK_APP_ID" type="string" default="" description="If you want to enable facebook connectivity, you need to create an &quot;app&quot; and enter that app's appid here."/>
		<!--<config key="/facebook/secretid" mapto="FACEBOOK_SECRET_ID" type="string" default="" description="The Facebook app secret, also required for connectivity to facebook apps."/>
		-->
		<config key="/facebook/appsecret" mapto="FACEBOOK_APP_SECRET" type="string" default="" description="The Facebook app secret, also required for connectivity to facebook apps."/>
	</configs>
	<users>
		<userconfig key="facebook_id" name="Facebook ID" hidden="1"/>
		<userconfig key="facebook_link" name="Facebook Link" hidden="1"/>
		<userconfig key="gender" name="Gender" onregistration="0" onedit="0" formtype="select" options="|Male|Female|Other"/>
		<userconfig key="facebook_access_token" name="Facebook Access Token (set on login)" hidden="1"/>
		<userauth name="facebook" class="\Facebook\UserAuth"/>
	</users>
	<view searchdir="templates">
		<file filename="templates/emails/facebook/enable_confirmation.tpl" md5="bb92457d47699f47892941267c00f83b"/>
		<file filename="templates/includes/user/facebook_login.tpl" md5="7546e92c592e0d7f1910a447c83f9ef5"/>
		<file filename="templates/pages/facebook/enable.tpl" md5="ef5061ca42ad0ad233b0b1db5175d96b"/>
		<file filename="templates/pages/facebook/login.tpl" md5="3271d46acd1a48dd6aec8c71dcc07862"/>
		<file filename="templates/widgets/facebook/login.tpl" md5="d2c35fdad4e78240358e39c4c4ee3db1"/>
	</view>
	<files>
		<file filename="CHANGELOG" md5="68d5381e829793e4a43f1ad5d47666b9"/>
		<file filename="FacebookHelper.class.php" md5="d7ac2466285ce37c587f9bb91e079aa9">
			<class name="FacebookHelper"/>
		</file>
		<file filename="controllers/FacebookController.php" md5="017e2b9f4ea2e44b60580b80347425e2">
			<controller name="FacebookController"/>
		</file>
		<file filename="i18n/strings.yml" md5="87b83d0ec84e6d05e62a718dd2e035d2"/>
		<file filename="libs/facebook-php-sdk/changelog.md" md5="31fce8336dd5a3f061686f19e19bd56d"/>
		<file filename="libs/facebook-php-sdk/composer.json" md5="5d17b681de9984e9af98629c2404f0a4"/>
		<file filename="libs/facebook-php-sdk/examples/example.php" md5="21f296ecba4b310c889ad661de54328d"/>
		<file filename="libs/facebook-php-sdk/examples/with_js_sdk.php" md5="555e738cb8c6b42834a5c5a2083bd3e6"/>
		<file filename="libs/facebook-php-sdk/readme.md" md5="b732598f748027abede8be4ef245bdb4"/>
		<file filename="libs/facebook-php-sdk/src/base_facebook.php" md5="8a5ce0443a3e1fa3634565fbe31badf9">
			<class name="FacebookApiException"/>
			<class name="BaseFacebook"/>
		</file>
		<file filename="libs/facebook-php-sdk/src/facebook.php" md5="439079e5184c24758e08f08313b8b659">
			<class name="Facebook"/>
		</file>
		<file filename="libs/facebook-php-sdk/src/fb_ca_chain_bundle.crt" md5="c4290b9deb70d0bef2f88b67fc68c8ec"/>
		<file filename="libs/facebook-php-sdk/tests/bootstrap.php" md5="b8bd1937c8d639841949a24e2fcdf983"/>
		<file filename="libs/facebook-php-sdk/tests/tests.php" md5="7d445aa0f8b042c65ddd9e703fe081c3">
			<class name="PHPSDKTestCase"/>
			<class name="TransientFacebook"/>
			<class name="FBRecordURL"/>
			<class name="FBRecordMakeRequest"/>
			<class name="FBPublic"/>
			<class name="PersistentFBPublic"/>
			<class name="FBCode"/>
			<class name="FBAccessToken"/>
			<class name="FBGetCurrentURLFacebook"/>
			<class name="FBPublicCookie"/>
			<class name="FBRewrite"/>
			<class name="FBPublicGetAccessTokenFromCode"/>
			<class name="FBPublicState"/>
		</file>
		<file filename="libs/facebook/UserAuth.php" md5="e5194d9bf27d63f65a5ebcf37b3a1144">
			<class name="Facebook\UserAuth"/>
		</file>
		<file filename="widgets/FacebookWidget.php" md5="fdb60f6c5cfefd6d5d52db5182f51fbd">
			<class name="FacebookWidget"/>
		</file>
	</files>
	<upgrades>
		<upgrade from="3.0.1~Core1" to="3.2.0~core1"/>
		<upgrade from="3.2.0~core1" to="3.2.0~core2"/>
		<upgrade from="3.2.0~core2" to="3.2.0~core3"/>
		<upgrade from="3.2.0~core3" to="3.2.0~core4"/>
		<upgrade from="3.2.0~core4" to="3.2.0~core5"/>
		<upgrade from="3.2.0~core5" to="3.2.0~core6"/>
		<upgrade from="3.2.0~core6" to="3.2.0~core7"/>
		<upgrade from="3.2.0~core7" to="3.2.0~core8"/>
		<upgrade from="3.2.0~core8" to="3.2.3~core1"/>
		<upgrade from="3.2.3~core1" to="3.2.3~core2"/>
		<upgrade from="3.2.3~core2" to="3.2.3~core3"/>
		<upgrade from="3.2.3~core3" to="3.2.3~core4"/>
		<upgrade from="3.2.3~core4" to="3.2.3~core5"/>
		<upgrade from="3.2.3~core5" to="3.2.3-6"/>
		<upgrade from="3.2.3-6" to="3.2.3-7"/>
	</upgrades>
	<assets>
		<file filename="assets/css/facebook.css" md5="705ee2ca2a443c5ff690c277ef26a2fe"/>
		<file filename="assets/js/facebook/login.js" md5="17a212d8244b41d712db7dbb480da122"/>
		<file filename="assets/js/facebook/login.min.js" md5="47160cc5f84a321aba41e44d4e786d22"/>
	</assets>
	<authors>
		<author name="Naitik Shah" email="naitik@facebook.com"/>
		<author name="Charlie Powell" email="charlie@evalagency.com"/>
	</authors>
	<licenses>
		<license url="http://www.gnu.org/licenses/agpl-3.0.txt">
			GNU Affero General Public License v3
		</license>
	</licenses>
</component>

