<?xml version="1.0"?>
<!DOCTYPE component PUBLIC "SYSTEM" "http://corepl.us/api/2_4/component.dtd">
<component xmlns:xsi="http://www.w3.org/2001/XMLSchema-instance" version="1.5.1" name="Blog" execmode="web">
	<requires>
		<require name="core" type="component" version="2.6.0" operation="ge"/>
		<require name="user" type="component" version="2.5.4"/>
		<require name="tags" type="component"/>
		<require name="JQuery-Full" type="component" version="1.9"/>
	</requires>
	<permissions>
		<permission key="blog_manage" description="Manage Blogs"/>
	</permissions>
	<hooks>
		<hook name="/cron/daily" call="BlogHelper::CronRetrieveRemoteFeeds"/>
	</hooks>
	<files>
		<file filename="CHANGELOG" md5="76e20b7c3ec3f1a33b48827500dc753d"/>
		<file filename="controllers/BlogController.php" md5="a543e226d15503c04193fb914ba783bc">
			<controller name="BlogController"/>
		</file>
		<file filename="helpers/BlogHelper.php" md5="61accf39c5879f6f906892195e38c8d3">
			<class name="BlogHelper"/>
		</file>
		<file filename="models/BlogArticleModel.php" md5="1bf56c3b92dbe784f78ea05e41ea480a">
			<class name="BlogArticleModel"/>
		</file>
		<file filename="models/BlogModel.php" md5="37bc0cf4adbacd59cd96fcb68f39a080">
			<class name="BlogModel"/>
		</file>
		<file filename="upgrades/121_to_130.php" md5="4f71587ed4a65da58490523dd9581684"/>
		<file filename="upgrades/130_to_140_published.php" md5="4ab899aa7768154bde4f5197a7cfbf2b"/>
		<file filename="upgrades/130_to_140_selectable.php" md5="33c3b2e0c9456a6a900d7340f1c65c5b"/>
		<file filename="upgrades/150_to_151_filepathchange.php" md5="d37162704ef850a8954bf11dcc66dc43"/>
	</files>
	<pages>
		<page baseurl="/blog/admin" admin="1" access="p:blog_manage" title="Blog Administration" group="Content"/>
		<page baseurl="/blog" title="Blogs"/>
	</pages>
	<description>Blog system.</description>
	<view searchdir="templates">
		<file filename="templates/pages/blog/admin.tpl" md5="44274363e8c7fea512396a63293c63fd"/>
		<file filename="templates/pages/blog/admin_view.tpl" md5="e1ca90792ff8835bee5ef1d03c54a851"/>
		<file filename="templates/pages/blog/article_create_update.tpl" md5="843616082c6990b3d75dded8e08d9025"/>
		<file filename="templates/pages/blog/article_view.tpl" md5="ec825042c51643a9955fdcf9184e86fb"/>
		<file filename="templates/pages/blog/article_view/review-post.tpl" md5="f645ccbfa064359ed5962077ad666ddd"/>
		<file filename="templates/pages/blog/create.tpl" md5="88a92a02a91699df3f24063112502867"/>
		<file filename="templates/pages/blog/editindex.tpl" md5="6795037bf2dc9bde8b4043b07839db46"/>
		<file filename="templates/pages/blog/import.tpl" md5="7e3f8c90db26ba500fa9e3ee439d2655"/>
		<file filename="templates/pages/blog/index.tpl" md5="9a74ac7f89123b40f8421b02ec9a3887"/>
		<file filename="templates/pages/blog/update.tpl" md5="e2df73ed8b507c4318fa29588015a80f"/>
		<file filename="templates/pages/blog/view-blog.atom.tpl" md5="5e7fe2a6a81b5c70b69094dce22ee078"/>
		<file filename="templates/pages/blog/view-blog.rss.tpl" md5="dc2fd8c75e28eb869d068c1919654c96"/>
		<file filename="templates/pages/blog/view-blog.tpl" md5="86fcd7022a353f51f73a101985ab6823"/>
	</view>
	<upgrades>
		<upgrade from="1.0.0" to="1.1.0"/>
		<upgrade from="1.1.0" to="1.2.0"/>
		<upgrade from="1.2.0" to="1.2.1"/>
		<upgrade from="1.2.1" to="1.3.0">
			<phpfileinclude>
				components/blog/upgrades/121_to_130.php
			</phpfileinclude>
		</upgrade>
		<upgrade from="1.2.9a" to="1.3.0"/>
		<upgrade from="1.3.0" to="1.4.0">
			<phpfileinclude>
				components/blog/upgrades/130_to_140_published.php
			</phpfileinclude>
			<phpfileinclude>
				components/blog/upgrades/130_to_140_selectable.php
			</phpfileinclude>
		</upgrade>
		<upgrade from="1.4.0" to="1.4.1"/>
		<upgrade from="1.4.1" to="1.4.2">
			<!-- This will retro-actively fix bug #321. -->
			<dataset action="update" table="page">
				<datasetset key="selectable">0</datasetset>
				<datasetwhere>
					baseurl LIKE /blog/article/view%
				</datasetwhere>
			</dataset>
		</upgrade>
		<upgrade from="1.4.2" to="1.4.3"/>
		<upgrade from="1.4.3" to="1.4.4"/>
		<upgrade from="1.4.4" to="1.4.5"/>
		<upgrade from="1.4.5" to="1.5.0"/>
		<upgrade from="1.5.0" to="1.5.1">
			<phpfileinclude>
				components/blog/upgrades/150_to_151_filepathchange.php
			</phpfileinclude>
		</upgrade>
	</upgrades>
	<assets>
		<file filename="assets/css/blog.css" md5="525a38d44528503b891cc5b7a094b98e"/>
		<file filename="assets/images/valid-atom.png" md5="e343955a970cb2f7834fdb550f600ab2"/>
		<file filename="assets/images/valid-rss.png" md5="7dac8fdd319e86cf82fa27bc7e2d416f"/>
		<file filename="assets/js/blog-waypoint-scroll.js" md5="785bccef5ce4f802b581d91d26fff6c7"/>
	</assets>
	<authors>
		<author name="Charlie Powell" email="charlie@eval.bz"/>
	</authors>
	<licenses>
		<license url="http://www.gnu.org/licenses/agpl-3.0.txt">
			GNU Affero General Public License v3
		</license>
	</licenses>
</component>

