<?xml version="1.0"?>
<!DOCTYPE component PUBLIC "SYSTEM" "http://corepl.us/api/2_4/component.dtd">
<component xmlns:xsi="http://www.w3.org/2001/XMLSchema-instance" version="1.4.3" name="Gallery" execmode="web">
	<requires>
		<require name="core" type="component" version="2.5.6" operation="ge"/>
	</requires>
	<permissions>
		<permission key="gallery_manage" description="Manage Galleries"/>
	</permissions>
	<pages>
		<page baseurl="/gallery" admin="0" access="*" title="Gallery Listings"/>
		<page baseurl="/galleryadmin" admin="1" access="g:admin" title="Gallery Administration" group="Content"/>
	</pages>
	<description>
		Gallery browsing system for core+
	</description>
	<view searchdir="templates">
		<file filename="templates/pages/gallery/images_update.tpl" md5="b59d2b61005d91762fecae40ad768f46"/>
		<file filename="templates/pages/gallery/index.tpl" md5="27602f4c3d5cfda3605738666567dac9"/>
		<file filename="templates/pages/gallery/order.tpl" md5="fa1cd954ed88ab26a41857456ec6904a"/>
		<file filename="templates/pages/gallery/update.tpl" md5="5db5bf97680ec52e8ee5b5580af17daa"/>
		<file filename="templates/pages/gallery/updatelisting.tpl" md5="6795037bf2dc9bde8b4043b07839db46"/>
		<file filename="templates/pages/gallery/view-audio.tpl" md5="13cee03374835e963916b9e46ed450ac"/>
		<file filename="templates/pages/gallery/view-file.tpl" md5="3bee771a5c30d6b9d6d4727cc3f47cba"/>
		<file filename="templates/pages/gallery/view-image.tpl" md5="ffdf3d6faf3f0b639a3aa6cbbada585e"/>
		<file filename="templates/pages/gallery/view-video.tpl" md5="abe65b701c1834e7f4a8d270d8cf5915"/>
		<file filename="templates/pages/gallery/view.tpl" md5="51298cf90ff2f2f385409aaa4aa95284"/>
		<file filename="templates/pages/galleryadmin/images.tpl" md5="3eabcaf67ce559f286c8cb1c00340072"/>
		<file filename="templates/pages/galleryadmin/index.tpl" md5="65bb6129b2ee5b3fac36ee425d3a9141"/>
		<file filename="templates/pages/galleryadmin/widgets.tpl" md5="638e42be8f47518515b13955f0e8fc44"/>
		<file filename="templates/pages/galleryadmin/widgets_update.tpl" md5="6795037bf2dc9bde8b4043b07839db46"/>
		<file filename="templates/widgets/gallery/view.tpl" md5="1740eb2a852e7a72233cc0d89bb485d3"/>
	</view>
	<files>
		<file filename="CHANGELOG" md5="8081147de76df99a5d507ba943805412"/>
		<file filename="controllers/GalleryAdminController.php" md5="e7e9e24bac09986c379ccc1115a9db5b">
			<controller name="GalleryAdminController"/>
		</file>
		<file filename="controllers/GalleryController.php" md5="c6a2808a69951ac9bbbacc1232d0d887">
			<controller name="GalleryController"/>
		</file>
		<file filename="helpers/GalleryFormHandler.class.php" md5="6244b62dda32b5f6d3460d3e0b8393b7">
			<class name="GalleryFormHandler"/>
		</file>
		<file filename="models/GalleryAlbumModel.php" md5="f3cd17ade1ba1260d1f46dc2a42755a0">
			<class name="GalleryAlbumModel"/>
		</file>
		<file filename="models/GalleryImageModel.php" md5="eaeddd69dbfbfa24e946429e2daba11c">
			<class name="GalleryImageModel"/>
		</file>
		<file filename="upgrades/140_to_141_cachedtitles.php" md5="0e316e5f9a13a315331c93f1fc44b4dc"/>
		<file filename="widgets/GalleryWidget.php" md5="7daa22785667f4e5ec91e4991952114b">
			<class name="GalleryWidget"/>
		</file>
	</files>
	<assets>
		<file filename="assets/css/gallery.css" md5="e067bf7c123c06eda156cba4c5f1ea06"/>
		<file filename="assets/gallery-arrow.png" md5="16bc541d24d9c8d5a124369eb51a4f8e"/>
	</assets>
	<upgrades>
		<upgrade from="1.0.0" to="1.1.0"/>
		<upgrade from="1.1.0" to="1.1.1"/>
		<upgrade from="1.1.1" to="1.2.0"/>
		<upgrade from="1.2.0" to="1.3.0"/>
		<upgrade from="1.3.0" to="1.3.1"/>
		<upgrade from="1.3.1" to="1.3.2"/>
		<upgrade from="1.3.2" to="1.3.3"/>
		<upgrade from="1.3.3" to="1.4.0"/>
		<upgrade from="1.4.0" to="1.4.1">
			<phpfileinclude>
				components/gallery/upgrades/140_to_141_cachedtitles.php
			</phpfileinclude>
		</upgrade>
		<upgrade from="1.4.1" to="1.4.2"/>
		<upgrade from="1.4.2" to="1.4.3"/>
	</upgrades>
	<authors>
		<author name="Charlie Powell" email="charlie@eval.bz"/>
	</authors>
	<licenses>
		<license url="http://www.gnu.org/licenses/agpl-3.0.txt">
			GNU Affero General Public License v3
		</license>
	</licenses>
</component>

