<?xml version="1.0" encoding="UTF-8"?>
<!DOCTYPE component SYSTEM "http://corepl.us/api/2_1/component.dtd">
<component xmlns:xsi="http://www.w3.org/2001/XMLSchema-instance" version="1.9.1" name="user" execmode="web">
	<requires>
		<require name="core" type="component"/>
		<require name="Facebook" type="component"/>
	</requires>
	<smartyplugins directory="helpers/smarty-plugins/"/>
	<hooks>
		<hook name="/core/page/error-403" call="UserController::_HookHandler403"/>
	</hooks>
	<forms>
		<formelement name="access" class="FormAccessStringInput"/>
	</forms>
	<files>
		<file filename="CHANGELOG" md5="db582f5a38f5ebe7253037ee8181b59b"/>
		<file filename="Controllers/UserController.class.php" md5="fabc6777ac5a4e077f614497f5e41c2f">
			<controller name="UserController"/>
		</file>
		<file filename="Models/UserConfigModel.class.php" md5="3f9ec960d49d5a547038ddf3d91aeff2">
			<class name="UserConfigModel"/>
		</file>
		<file filename="Models/UserGroupModel.php" md5="4ad86ff7b1be60e1713195c4be07315d">
			<class name="UserGroupModel"/>
		</file>
		<file filename="Models/UserModel.class.php" md5="a99db3b236a330ddf9a1bb91d71e824d">
			<class name="UserModel"/>
		</file>
		<file filename="Models/UserUserConfigModel.class.php" md5="4bfc5564e1c98099374adf6de3bed563">
			<class name="UserUserConfigModel"/>
		</file>
		<file filename="User.class.php" md5="855a529712007bea2639958ee2b1d999">
			<class name="User"/>
			<class name="UserException"/>
		</file>
		<file filename="UserForm.class.php" md5="82dbfbb7871e415dfcc41fb7ff8bb1ad">
			<class name="FormAccessStringInput"/>
		</file>
		<file filename="User_Backend.interface.php" md5="699b8df9f6b8af73de189bdb0b0b1057">
			<interface name="User_Backend"/>
		</file>
		<file filename="Widgets/UserLoginWidget.class.php" md5="04d3602121f6cb231473284124dfa88f">
			<class name="UserLoginWidget"/>
		</file>
		<file filename="Widgets/UserWidget.class.php" md5="85affeee8ce7c56dad1e2ff6582bcb09">
			<class name="UserWidget"/>
		</file>
		<file filename="backends/User_datamodel.backend.php" md5="52e3a06ab605f547a984793281865793">
			<class name="User_datamodel_Backend"/>
		</file>
		<file filename="backends/User_facebook.backend.php" md5="9b56ef72aac8afdeaf37f303c26f1005">
			<class name="User_facebook_Backend"/>
		</file>
		<file filename="helpers/UserFunctions.php" md5="e1d98eef6534affb7bbaabbd682996cb"/>
		<file filename="helpers/smarty-plugins/block.permission.php" md5="d0bc40bbf5a9e48ee2331fcfb10bf408"/>
	</files>
	<view>
		<file filename="templates/widgets/userlogin.tpl" md5="8a8d32b7f36e7ee581ece66be94b4d2d"/>
		<file filename="templates/emails/user/forgotpassword.tpl" md5="3cceaf071bb8cd76a9f7c15fcc1da84e"/>
		<file filename="templates/emails/user/registration.tpl" md5="bc0af99c272dc0849608642ef56185f2"/>
		<file filename="templates/pages/user/register.tpl" md5="6795037bf2dc9bde8b4043b07839db46"/>
		<file filename="templates/pages/user/forgotpassword.tpl" md5="c2da0dced97b6b643b20c40a5046b5d1"/>
		<file filename="templates/pages/user/login.tpl" md5="b499441b575fa4bd2e7dd9ac2e49f52b"/>
		<file filename="templates/forms/elements/formaccessstringinput.tpl" md5="f230fcddefd98780d34bb7a9b3a38ac5"/>
		<file filename="templates/widgets/userlogin/execute.tpl" md5="8a8d32b7f36e7ee581ece66be94b4d2d"/>
		<file filename="templates/widgets/user/login.tpl" md5="74b44e98b27d05efd66ba03a377a8816"/>
		<file filename="templates/widgets/user/register.tpl" md5="6795037bf2dc9bde8b4043b07839db46"/>
		<file filename="templates/widgets/userlogin/execute.tpl" md5="8b33f6adb9fdadf3a6f4e10f6722de2e"/>
	</view>
	<pages>
		<page baseurl="/User/Login" admin="0" widget="0" access="!g:authenticated" title="Login"/>
		<page baseurl="/User/Register" admin="0" widget="0" access="!g:authenticated" title="Register"/>
		<page baseurl="/User/Logout" admin="0" widget="0" access="g:authenticated" title="Logout"/>
	</pages>
	<widgets>
		<widget baseurl="/UserWidget/Login"/>
		<widget baseurl="/UserWidget/Register"/>
	</widgets>
	<configs>
		<config key="/user/register/requirecaptcha" type="boolean" default="0" description=""/>
		<config key="/user/backends" type="set" default="datamodel" description="" options="datamodel| facebook| ldap"/>
		<config key="/user/password/minlength" type="int" default="8" description=""/>
		<config key="/user/password/requiresymbols" type="int" default="0" description=""/>
		<config key="/user/password/requirecapitals" type="int" default="0" description=""/>
		<config key="/user/displayname/displayoptions" type="set" options="username|firstname|emailbase|emailfull" default="username|firstname|emailbase" description=""/>
		<config key="/user/displayname/anonymous" type="string" default="Guest" description=""/>
		<config key="/user/displayname/authenticated" type="string" default="Member" description=""/>
		<config key="/user/register/allowpublic" type="boolean" default="true" description="Allow public registrations"/>
	</configs>
	<assets>
		<file filename="assets/js/user/login.js" md5="f48e188960e94f209e89f5168b101983"/>
		<file filename="assets/js/user/user.js" md5="b8793bfd7cd6ebeb3a9889905b300f7a"/>
	</assets>
	<description>
		The user component provides core user functionality, including registration, login, forgot password and access controls.
	</description>
	<otherfiles>
		<file filename="helpers/smarty-plugins/block.permission.php" md5="f909ae6c68833e4dc221594f3472d94d"/>
	</otherfiles>
	<upgrades>
		<upgrade from="0.0.1-dev1" to="0.0.2"/>
		<upgrade from="0.0.2" to="0.0.3"/>
		<upgrade from="0.0.3" to="1.9.0"/>
		<upgrade from="1.9.0" to="1.9.1">
			<dataset action="update" table="widget">
				<datasetset key="baseurl">/userwidget/login</datasetset>
				<datasetwhere>
					baseurl = /UserLoginWidget/execute
				</datasetwhere>
			</dataset>
		</upgrade>
	</upgrades>
	<authors>
		<author name="Charlie Powell" email="charlie@eval.bz"/>
	</authors>
	<licenses>
		<license url="http://www.gnu.org/licenses/agpl-3.0.txt">
			GNU Affero General Public License v3
		</license>
	</licenses>
</component>

