<?xml version="1.0" encoding="UTF-8"?>
<!DOCTYPE component SYSTEM "http://corepl.us/api/2_1/component.dtd">
<component xmlns:xsi="http://www.w3.org/2001/XMLSchema-instance" version="2.0~core2" name="FontAwesome" execmode="web">
	<requires>
		<require name="core" type="component" version="2.1.0" operation="ge"/>
	</requires>
	<provides>
		<scriptlibrary name="fontawesome" call="FontAwesome::Load"/>
	</provides>
	<description>
		The iconic font designed for use with Twitter Bootstrap
	</description>
	<files>
		<file filename="FontAwesome-Vectors.pdf" md5="4bdcf9dc73a13c8f1c3bd6be6fd2de49"/>
		<file filename="FontAwesome.lib.php" md5="f390e22f306175178982dc0f275689b4">
			<class name="FontAwesome"/>
		</file>
		<file filename="README.md" md5="bcb91e0d16d1f010effa565d0c7980d2"/>
	</files>
	<assets>
		<file filename="assets/css/font-awesome-ie7.css" md5="461c93f69710a40e0bc6851a84ed76c9"/>
		<file filename="assets/css/font-awesome-tweaks.css" md5="ffa4ef1c9f29652091f87bdc56faafd0"/>
		<file filename="assets/css/font-awesome.css" md5="764eba9c7d44a3c91244ecee8736feac"/>
		<file filename="assets/font/fontawesome-webfont.eot" md5="5f4a40c122903174c4227e6871b88cff"/>
		<file filename="assets/font/fontawesome-webfont.svg" md5="13420cbc7af6227733d1a12e5df28fe9"/>
		<file filename="assets/font/fontawesome-webfont.ttf" md5="6ea09593203493bfd053a1e838c62404"/>
		<file filename="assets/font/fontawesome-webfont.woff" md5="04b9bfc362dcb9bc999c7d1bcb44a942"/>
	</assets>
	<upgrades>
		<upgrade from="2.0" to="2.0~core2"/>
	</upgrades>
	<authors>
		<author name="Dave Gandy" email="dave@davegandy.com"/>
	</authors>
	<licenses>
		<license url="http://creativecommons.org/licenses/by/3.0/">CC BY 3.0</license>
	</licenses>
</component>

