<?xml version="1.0"?>
<!DOCTYPE component PUBLIC "SYSTEM" "http://corepl.us/api/2_4/component.dtd">
<component xmlns:xsi="http://www.w3.org/2001/XMLSchema-instance" version="2.1.9" name="Navigation" execmode="web">
	<requires>
		<require name="core" type="component" operation="ge" version="2.5.6"/>
	</requires>
	<files>
		<file filename="CHANGELOG" md5="e6389cccc1b959677ca2058268b310e8"/>
		<file filename="controllers/NavigationController.php" md5="e1f41f41e41aff37a4098c14198f2327">
			<controller name="NavigationController"/>
		</file>
		<file filename="models/Navigation.model.php" md5="556a19051c430a73a838bcf5e44d09e7">
			<class name="NavigationModel"/>
		</file>
		<file filename="models/NavigationEntry.model.php" md5="86d030909068fa026a1e8d4ba1836dde">
			<class name="NavigationEntryModel"/>
		</file>
		<file filename="widgets/NavigationWidget.php" md5="8321c54fcb1743d2fbb80ad556ec7530">
			<class name="NavigationWidget"/>
		</file>
	</files>
	<view>
		<file filename="templates/pages/navigation/create.tpl" md5="75c1c4157d0b64b0f5e05fa3a0ee9846"/>
		<file filename="templates/pages/navigation/create_edit.inc.tpl" md5="4031fb3dc83afb83f716a6150a479a55"/>
		<file filename="templates/pages/navigation/delete.tpl" md5="76e1949488cb9acaaf83eb1a95c9abd5"/>
		<file filename="templates/pages/navigation/edit.tpl" md5="a6eda39bbc1a33dac2888ffe43ab7868"/>
		<file filename="templates/pages/navigation/index.tpl" md5="8fbbccd35a3cbc609cc8845b6a3a45ee"/>
		<file filename="templates/pages/navigation/view.tpl" md5="44b506f0e3ca0a1bfef9d5f4b992a8c0"/>
		<file filename="templates/widgets/navigation/_menu.inc.tpl" md5="d64446108dff7be324ae96c683b7b04e"/>
		<file filename="templates/widgets/navigation/children.tpl" md5="2f26fdaa35d28a1a094699a825db64d8"/>
		<file filename="templates/widgets/navigation/siblings.tpl" md5="e02e7719cfb212e4d9f5637b396e5f10"/>
		<file filename="templates/widgets/navigation/siblingsandchildren.tpl" md5="2f26fdaa35d28a1a094699a825db64d8"/>
		<file filename="templates/widgets/navigation/view.tpl" md5="629c5fcb1cd7f3ecddff0451bc1eee7a"/>
	</view>
	<pages>
		<page baseurl="/Navigation" admin="1" access="" title="Navigation Listings" group="Theme and Layouts"/>
	</pages>
	<widgets>
		<widget baseurl="/navigation/siblings" title="Page Siblings Nav"/>
		<widget baseurl="/navigation/siblingsandchildren" title="Page Siblings w/Children Nav"/>
		<widget baseurl="/navigation/children" title="Page Children Nav"/>
	</widgets>
	<assets>
		<file filename="assets/js/navigation/manager.js" md5="e7852b3c06f5b208e35b1cb5ad08f84f"/>
	</assets>
	<upgrades>
		<upgrade from="0.0.1-dev1" to="1.9.0"/>
		<upgrade from="1.9.0" to="1.9.1"/>
		<upgrade from="1.9.1" to="2.0.0"/>
		<upgrade from="2.0.0" to="2.1.0"/>
		<upgrade from="2.1.0" to="2.1.1"/>
		<upgrade from="2.1.1" to="2.1.2"/>
		<upgrade from="2.1.2" to="2.1.3"/>
		<upgrade from="2.1.3" to="2.1.4"/>
		<upgrade from="2.1.4" to="2.1.5"/>
		<upgrade from="2.1.5" to="2.1.6"/>
		<upgrade from="2.1.6" to="2.1.7"/>
		<upgrade from="2.1.7" to="2.1.8"/>
		<upgrade from="2.1.8" to="2.1.9"/>
	</upgrades>
	<authors>
		<author name="Charlie Powell" email="charlie@eval.bz"/>
	</authors>
	<licenses>
		<license url="http://www.gnu.org/licenses/agpl-3.0.txt">
			GNU Affero General Public License v3
		</license>
	</licenses>
</component>

