<?xml version="1.0"?>
<!DOCTYPE component PUBLIC "SYSTEM" "http://corepl.us/api/2_4/component.dtd">
<component xmlns:xsi="http://www.w3.org/2001/XMLSchema-instance" version="1.4.0" name="Google" execmode="web">
	<requires>
		<require name="core" type="component" version="3.4.0" operation="ge"/>
	</requires>
	<provides>
		<provide version="3.12" name="GoogleMaps" type="library"/>
		<provide version="1.1.0" name="GoogleAnalytics" type="library"/>
		<provide version="1.1.0" name="GoogleAnalytics" type="component"/>
	</provides>
	<hooks>
		<hook name="/core/page/preexecute" call="\Google\Analytics\Helper::InstallTracking"/>
		<hook name="/core/page/error-404" call="\Google\CSE\Helper::SiteSearch"/>
	</hooks>
	<description>
		Provides (in theory), many of the Google API products.
	</description>
	<configs>
		<config key="/googlemaps/enterprise/privatekey" type="string" default="" description="Private key for Google Maps Enterprise"/>
		<config key="/googlemaps/enterprise/clientname" type="string" description="Client name for Google Maps Enterprise"/>
		<config key="/google-analytics/accountid" type="string" default="" title="Google Account ID" description="This is the Account ID (sometimes called 'Web Property ID') listed for this account in google analytics.  Leaving this blank will disable GA; likewise populating it will automatically enable GA."/>
		<config key="/google/tagmanager/tagid" type="string" default="" title="Google Tag ID" description="If you use Tag Manager to manage tags, enter your tag ID here &lt;em&gt;instead of&lt;/em&gt; your account ID."/>
		<config key="/google/cse/key" type="string" default="" description="The cx for Google CSE Site Search"/>
	</configs>
	<pages>
		<page baseurl="/google/configure" title="Google Keys and Apps" group="Configure" access="g:admin" admin="1" selectable="0"/>
	</pages>
	<files>
		<file filename="CHANGELOG" md5="d12a12d43442d1a22269cf26a54764fb"/>
		<file filename="controllers/GoogleController.php" md5="54d2494188cb6d9c37fc41b1eb56f09f">
			<controller name="GoogleController"/>
		</file>
		<file filename="libs/google/CSE/Helper.php" md5="dc2a7df940960944b36541357309b1c6">
			<class name="Google\CSE\Helper"/>
		</file>
		<file filename="libs/google/analytics/Helper.php" md5="739c3de8a435882d8d71b59b471a6ddc">
			<class name="Google\Analytics\Helper"/>
		</file>
		<file filename="libs/google/maps/GeocodeRequest.php" md5="29b8a83d0e136b1dd5027c247b3568f2">
			<class name="Google\Maps\GeocodeRequest"/>
		</file>
		<file filename="libs/google/maps/GeocodeResponse.php" md5="86c7fd0d5cc93f30e288e76934b3bcd4">
			<class name="Google\Maps\GeocodeResponse"/>
		</file>
	</files>
	<upgrades>
		<upgrade from="1.0.0" to="1.0.1"/>
		<upgrade from="1.0.1" to="1.0.2">
			<!-- Remove the old component's page on upgrade. -->
			<dataset action="delete" table="page">
				<datasetwhere>baseurl = /googleapi/configure</datasetwhere>
			</dataset>
		</upgrade>
		<upgrade from="1.0.2" to="1.1.0"/>
		<upgrade from="1.1.0" to="1.2.0"/>
		<upgrade from="1.2.0" to="1.2.1"/>
		<upgrade from="1.2.1" to="1.3.0"/>
		<upgrade from="1.3.0" to="1.3.1"/>
		<upgrade from="1.3.1" to="1.4.0"/>
	</upgrades>
	<view>
		<file filename="templates/pages/google/configure.tpl" md5="a3fc7915404242b727080991ab014cda"/>
	</view>
	<authors>
		<author name="Charlie Powell" email="charlie@eval.bz"/>
		<author name="Nicholas Hinsch" email="nicholas@eval.bz"/>
	</authors>
	<licenses>
		<license url="http://www.gnu.org/licenses/agpl-3.0.txt">
			GNU Affero General Public License v3
		</license>
	</licenses>
</component>

