<?xml version="1.0" encoding="UTF-8"?>
<!DOCTYPE component SYSTEM "http://corepl.us/api/2_1/component.dtd">
<component xmlns:xsi="http://www.w3.org/2001/XMLSchema-instance" version="1.0.1" name="markdown-browser" execmode="web">
	<requires>
		<require name="core" type="component"/>
		<require name="markdown" type="component" version="1.2.5" operation="ge"/>
	</requires>
	<description>
		Provides an inline browser experience for markdown files.
	</description>
	<files>
		<file filename="controllers/MarkdownBrowserController.php" md5="7c0eb6ef5bc079af1f4f46a50532f992">
			<controller name="MarkdownBrowserController"/>
		</file>
	</files>
	<view searchdir="templates">
		<file filename="templates/pages/markdownbrowser/index.tpl" md5="ced87d369e77f7553c285189d67c5cc7"/>
		<file filename="templates/pages/markdownbrowser/index.tpl" md5="2dfc8f64c4fe06140d998bc39464bbcf"/>
		<file filename="templates/pages/markdownbrowser/update.tpl" md5="f9e09c641e7125acc9f3f59ef54dd9cb"/>
		<file filename="templates/pages/markdownbrowser/view-file.tpl" md5="35d194b1b49f068ad8df448098ed7f7c"/>
		<file filename="templates/pages/markdownbrowser/view-listing.tpl" md5="c2c174a157752750e0f51f8b0acddc8b"/>
	</view>
	<pages>
		<page baseurl="/markdownbrowser" admin="1" widget="0" access="g:admin" title="Markdown Directory Listings"/>
	</pages>
	<upgrades>
		<upgrade from="1.0.0" to="1.0.1"/>
	</upgrades>
	<authors>
		<author name="Charlie Powell" email="charlie@eval.bz"/>
	</authors>
	<licenses>
		<license url="http://www.gnu.org/licenses/agpl-3.0.txt">
			GNU Affero General Public License v3
		</license>
	</licenses>
</component>

