<?xml version="1.0"?>
<!DOCTYPE component PUBLIC "SYSTEM" "http://corepl.us/api/2_4/component.dtd">
<component xmlns:xsi="http://www.w3.org/2001/XMLSchema-instance" version="3.1.0" name="Content" execmode="web" logo="assets/images/logos/content.png">
	<requires>
		<require name="core" type="component" version="6.2.0" operation="ge"/>
	</requires>
	<permissions>
		<permission key="/content/manage_all" description="Manage Site Content"/>
	</permissions>
	<widgets>
		<widget baseurl="/contentadmin/quickdraft" title="Quick Draft" installable="/admin"/>
		<widgetcreate title="Content Area" class="ContentWidget"/>
	</widgets>
	<files>
		<file filename="CHANGELOG" md5="95731348a3305927c51532b80b7631bd"/>
		<file filename="controllers/ContentController.php" md5="257cc521aa0d20e30e657a219b1e43c9">
			<controller name="ContentController"/>
		</file>
		<file filename="i18n/strings.yml" md5="03d1435baa1b6984b25cf8199dbaea8f"/>
		<file filename="models/ContentModel.php" md5="7d24ea7784ccc04a9bba62b188a3d6ca">
			<class name="ContentModel"/>
		</file>
		<file filename="upgrades/310_page_updates.php" md5="549b9de9daba51cff04fe6c2cd6d6db1"/>
		<file filename="widgets/ContentAdminWidget.php" md5="b72ef60f5c4b7470bebcf5c238940013">
			<class name="ContentAdminWidget"/>
		</file>
		<file filename="widgets/ContentWidget.php" md5="75874895c89d80bf137a2cf3787081aa">
			<class name="ContentWidget"/>
		</file>
	</files>
	<pages>
		<page title="t:STRING_NEW_CONTENT_PAGE" baseurl="/content/create" access="p:/content/manage_all" admin="1" group="t:STRING_CONTENT"/>
		<pagecreate title="t:STRING_CONTENT_PAGE" baseurl="/content/create" description="t:MESSAGE_CONTENT_PAGE"/>
	</pages>
	<description>
		Provides basic HTML page functionality.
	</description>
	<view searchdir="templates">
		<file filename="templates/pages/content/create.tpl" md5="1f45af7838e6eb4421220a6dd5a8428d"/>
		<file filename="templates/pages/content/delete.tpl" md5="64255b05d03ba0b58cbacb107e2b2dff"/>
		<file filename="templates/pages/content/edit.tpl" md5="1f45af7838e6eb4421220a6dd5a8428d"/>
		<file filename="templates/pages/content/view.tpl" md5="f9a40b24658d333da22f7726de3d032e"/>
		<file filename="templates/pages/content/view/markdown.tpl" md5="6d535f0b3cb7bbabdd70b9e1935bf034"/>
		<file filename="templates/pages/content/view/option1.tpl" md5="4c8037182441dcac26d7f31496ac2a1a"/>
		<file filename="templates/widgets/content/execute.tpl" md5="0db0ff3eae107a310d9b9fe853452575"/>
		<file filename="templates/widgets/contentadmin/quickdraft.tpl" md5="c97347fb8b98c3dfd8df2430db7572ef"/>
	</view>
	<upgrades>
		<upgrade from="0.0.1-dev1" to="1.9.0"/>
		<upgrade from="1.9.0" to="1.9.1"/>
		<upgrade from="1.9.1" to="1.9.2"/>
		<upgrade from="1.9.2" to="1.9.3"/>
		<upgrade from="1.9.3" to="1.9.4"/>
		<upgrade from="1.9.4" to="1.9.5"/>
		<upgrade from="1.9.5" to="1.9.6"/>
		<upgrade from="1.9.6" to="2.0.0"/>
		<upgrade from="2.0.0" to="2.0.1b1"/>
		<upgrade from="2.0.0" to="2.0.1"/>
		<upgrade from="2.0.1b1" to="2.0.1"/>
		<upgrade from="2.0.1" to="2.0.2"/>
		<upgrade from="2.0.2" to="2.0.3"/>
		<upgrade from="2.0.3" to="2.0.4"/>
		<upgrade from="2.0.4" to="2.1.0"/>
		<upgrade from="2.1.0" to="2.2.0">
			<php file="upgrades/310_page_updates.php"/>
		</upgrade>
		<upgrade from="2.2.0" to="2.3.0"/>
		<upgrade from="2.3.0" to="2.3.1"/>
		<upgrade from="2.3.1" to="2.4.0"/>
		<upgrade from="2.4.0" to="2.4.1"/>
		<upgrade from="2.4.1" to="2.4.2"/>
		<upgrade from="2.4.2" to="2.5.0"/>
		<upgrade from="2.5.0" to="2.5.1"/>
		<upgrade from="2.5.1" to="2.5.2"/>
		<upgrade from="2.5.2" to="3.0.0"/>
		<upgrade from="3.0.0" to="3.0.1"/>
		<upgrade from="3.0.1" to="3.1.0"/>
	</upgrades>
	<assets>
		<file filename="assets/images/logos/content.png" md5="86beb406ad3daac3eabb800366fc1bb7"/>
		<file filename="assets/images/previews/templates/widgets/content/custom-content-area-140.png" md5="673cfa327007694704fe95e47dcc9ec0"/>
		<file filename="assets/images/previews/templates/widgets/content/custom-content-area-210.png" md5="4908ee304cc74dadd78bf4eeddf5c12c"/>
		<file filename="assets/images/previews/templates/widgets/content/custom-content-area.png" md5="f8cea628a881b575aecfa54f1fd32500"/>
	</assets>
</component>

